19:29:52.065753 IP localhost.51423 > localhost.45487: . 1522895096:1522911480(16384) ack 1319770957 win 257 <nop,nop,timestamp 1889426917 1889425917>
E.@4..@.@.r=............Z...N..M....>).....
p.].p.Y...............................
19:29:52.065778 IP localhost.45487 > localhost.51423: . ack 16384 win 2605 <nop,nop,timestamp 1889426917 1889426917>
E..4D.@.@..A............N..MZ.....
-.A.....
p.].p.].
19:29:52.065801 IP localhost.51423 > localhost.45487: . 16384:32768(16384) ack 1 win 257 <nop,nop,timestamp 1889426917 1889425917>
E.@4..@.@.r<............Z...N..M....>).....
p.].p.Y...............................
19:29:52.065818 IP localhost.45487 > localhost.51423: . ack 32768 win 2507 <nop,nop,timestamp 1889426917 1889426917>
E..4D.@.@..@............N..MZ.....	........
p.].p.].
19:29:52.065820 IP localhost.51423 > localhost.45487: P 32768:35021(2253) ack 1 win 257 <nop,nop,timestamp 1889426917 1889426917>
E.	...@.@..n............Z...N..M...........
p.].p.]...............................
19:29:52.065833 IP localhost.45487 > localhost.51423: . ack 35021 win 2490 <nop,nop,timestamp 1889426917 1889426917>
E..4D.@.@..?............N..MZ.....	........
p.].p.].
19:29:52.070643 IP localhost.53643 > localhost.45484: . 4139323915:4139340299(16384) ack 3459818722 win 257 <nop,nop,timestamp 1889426922 1889425925>
E.@4$]@.@..d.................8......>).....
p.].p.Z..$H.....................l+...
19:29:52.070671 IP localhost.45484 > localhost.53643: . ack 16384 win 14450 <nop,nop,timestamp 1889426922 1889426922>
E..4~.@.@................8....R...8rd......
p.].p.].
19:29:52.070773 IP localhost.53643 > localhost.45484: . 16384:32768(16384) ack 1 win 257 <nop,nop,timestamp 1889426922 1889425925>
E.@4$^@.@..c..............R..8......>).....
p.].p.Z...............................
19:29:52.070783 IP localhost.45484 > localhost.53643: . ack 32768 win 14450 <nop,nop,timestamp 1889426922 1889426922>
E..4~.@.@................8........8r$......
p.].p.].
19:29:52.071590 IP localhost.53643 > localhost.45484: . 32768:49152(16384) ack 1 win 257 <nop,nop,timestamp 1889426923 1889426922>
E.@4$_@.@..b.................8......>).....
p.].p.]...............................
19:29:52.071613 IP localhost.45484 > localhost.53643: . ack 49152 win 14450 <nop,nop,timestamp 1889426923 1889426923>
E..4~.@.@................8........8r.......
p.].p.].
19:29:52.071677 IP localhost.53643 > localhost.45484: . 49152:65536(16384) ack 1 win 257 <nop,nop,timestamp 1889426923 1889426922>
E.@4$`@.@..a.................8......>).....
p.].p.]...............................
19:29:52.071696 IP localhost.45484 > localhost.53643: . ack 65536 win 14450 <nop,nop,timestamp 1889426923 1889426923>
E..4~.@.@................8........8r.......
p.].p.].
19:29:52.071749 IP localhost.53643 > localhost.45484: . 65536:81920(16384) ack 1 win 257 <nop,nop,timestamp 1889426923 1889426922>
E.@4$a@.@..`.................8......>).....
p.].p.]...............................
19:29:52.071766 IP localhost.45484 > localhost.53643: . ack 81920 win 14450 <nop,nop,timestamp 1889426923 1889426923>
E..4~.@.@................8....R...8rd......
p.].p.].
19:29:52.071813 IP localhost.53643 > localhost.45484: . 81920:98304(16384) ack 1 win 257 <nop,nop,timestamp 1889426923 1889426922>
E.@4$b@.@.._..............R..8......>).....
p.].p.]...............................
19:29:52.071830 IP localhost.45484 > localhost.53643: . ack 98304 win 14450 <nop,nop,timestamp 1889426923 1889426923>
E..4~.@.@................8........8r$......
p.].p.].
19:29:52.071879 IP localhost.53643 > localhost.45484: . 98304:114688(16384) ack 1 win 257 <nop,nop,timestamp 1889426923 1889426923>
E.@4$c@.@..^.................8......>).....
p.].p.]...............................
19:29:52.071892 IP localhost.45484 > localhost.53643: . ack 114688 win 14450 <nop,nop,timestamp 1889426923 1889426923>
E..4~.@.@................8........8r.......
p.].p.].
19:29:52.071935 IP localhost.53643 > localhost.45484: . 114688:131072(16384) ack 1 win 257 <nop,nop,timestamp 1889426923 1889426923>
E.@4$d@.@..].................8......>).....
p.].p.]...............................
19:29:52.071961 IP localhost.45484 > localhost.53643: . ack 131072 win 14450 <nop,nop,timestamp 1889426923 1889426923>
E..4~.@.@................8........8r.......
p.].p.].
19:29:52.072012 IP localhost.53643 > localhost.45484: . 131072:147456(16384) ack 1 win 257 <nop,nop,timestamp 1889426923 1889426923>
E.@4$e@.@..\.................8......>).....
p.].p.].H/j.1..-...'+@........)\....0@
19:29:52.072022 IP localhost.45484 > localhost.53643: . ack 147456 win 14450 <nop,nop,timestamp 1889426923 1889426923>
E..4~.@.@................8....R...8rd......
p.].p.].
19:29:52.072066 IP localhost.53643 > localhost.45484: . 147456:163840(16384) ack 1 win 257 <nop,nop,timestamp 1889426923 1889426923>
E.@4$f@.@..[..............R..8......>).....
p.].p.]........-...'..^d.~...@.-...'..
19:29:52.072078 IP localhost.45484 > localhost.53643: . ack 163840 win 14450 <nop,nop,timestamp 1889426923 1889426923>
E..4~.@.@................8........8r$......
p.].p.].
19:29:52.072125 IP localhost.53643 > localhost.45484: . 163840:180224(16384) ack 1 win 257 <nop,nop,timestamp 1889426923 1889426923>
E.@4$g@.@..Z.................8......>).....
p.].p.].A.B.A.A.A.A.A.B.A.A.A.Y.Y.Y.Y.
19:29:52.072141 IP localhost.45484 > localhost.53643: . ack 180224 win 14450 <nop,nop,timestamp 1889426923 1889426923>
E..4~.@.@................8........8r.......
p.].p.].
19:29:52.072186 IP localhost.53643 > localhost.45484: . 180224:196608(16384) ack 1 win 257 <nop,nop,timestamp 1889426923 1889426923>
E.@4$h@.@..Y.................8......>).....
p.].p.].3.3.4.4.3.3.3.3.3.3.3.4.3.3.3.
19:29:52.072203 IP localhost.45484 > localhost.53643: . ack 196608 win 14450 <nop,nop,timestamp 1889426924 1889426923>
E..4~.@.@................8........8r.......
p.].p.].
19:29:52.072261 IP localhost.53643 > localhost.45484: . 196608:212992(16384) ack 1 win 257 <nop,nop,timestamp 1889426924 1889426923>
E.@4$i@.@..X.................8......>).....
p.].p.].?.?.?.?.?...?.?.>.?.?.?.?.?.?.
19:29:52.072277 IP localhost.45484 > localhost.53643: . ack 212992 win 14450 <nop,nop,timestamp 1889426924 1889426924>
E..4~.@.@................8....R...8rd......
p.].p.].
19:29:52.072320 IP localhost.53643 > localhost.45484: . 212992:229376(16384) ack 1 win 257 <nop,nop,timestamp 1889426924 1889426923>
E.@4$j@.@..W..............R..8......>).....
p.].p.]...............................
19:29:52.072334 IP localhost.45484 > localhost.53643: . ack 229376 win 14450 <nop,nop,timestamp 1889426924 1889426924>
E..4~.@.@................8........8r$......
p.].p.].
19:29:52.072380 IP localhost.53643 > localhost.45484: . 229376:245760(16384) ack 1 win 257 <nop,nop,timestamp 1889426924 1889426923>
E.@4$k@.@..V.................8......>).....
p.].p.].@.A.@.@.@.@.@.@.@.@.@.@.@.@.@.
19:29:52.072396 IP localhost.45484 > localhost.53643: . ack 245760 win 14450 <nop,nop,timestamp 1889426924 1889426924>
E..4~.@.@................8........8r.......
p.].p.].
19:29:52.072439 IP localhost.53643 > localhost.45484: . 245760:262144(16384) ack 1 win 257 <nop,nop,timestamp 1889426924 1889426923>
E.@4$l@.@..U.................8......>).....
p.].p.].O.O.O.O.O.O.O...P.O.O.O.O.P.P.
19:29:52.072455 IP localhost.45484 > localhost.53643: . ack 262144 win 14450 <nop,nop,timestamp 1889426924 1889426924>
E..4~ @.@................8........8r.......
p.].p.].
19:29:52.072501 IP localhost.53643 > localhost.45484: . 262144:278528(16384) ack 1 win 257 <nop,nop,timestamp 1889426924 1889426923>
E.@4$m@.@..T.................8......>).....
p.].p.]...............................
19:29:52.072554 IP localhost.53643 > localhost.45484: . 278528:294912(16384) ack 1 win 257 <nop,nop,timestamp 1889426924 1889426923>
E.@4$n@.@..S..............R..8......>).....
p.].p.].H...I.I.I.I.I.I.I.H.I.I.I.I.H.
19:29:52.072570 IP localhost.45484 > localhost.53643: . ack 294912 win 14450 <nop,nop,timestamp 1889426924 1889426924>
E..4~!@.@................8........8r$......
p.].p.].
19:29:52.072616 IP localhost.53643 > localhost.45484: . 294912:311296(16384) ack 1 win 257 <nop,nop,timestamp 1889426924 1889426923>
E.@4$o@.@..R.................8......>).....
p.].p.]...............................
19:29:52.072670 IP localhost.53643 > localhost.45484: . 311296:327680(16384) ack 1 win 257 <nop,nop,timestamp 1889426924 1889426923>
E.@4$p@.@..Q.................8......>).....
p.].p.].B.B.C.B.B.B.B.B.B.B.B.B.C.B.B.
19:29:52.072687 IP localhost.45484 > localhost.53643: . ack 327680 win 14450 <nop,nop,timestamp 1889426924 1889426924>
E..4~"@.@................8........8r.......
p.].p.].
19:29:52.072738 IP localhost.53643 > localhost.45484: . 327680:344064(16384) ack 1 win 257 <nop,nop,timestamp 1889426924 1889426923>
E.@4$q@.@..P.................8......>).....
p.].p.]...............................
19:29:52.072793 IP localhost.53643 > localhost.45484: . 344064:360448(16384) ack 1 win 257 <nop,nop,timestamp 1889426924 1889426923>
E.@4$r@.@..O..............R..8......>).....
p.].p.].R.S.R.R.S.S.S.R.S.R.R...R.R.R.
19:29:52.072809 IP localhost.45484 > localhost.53643: . ack 360448 win 14450 <nop,nop,timestamp 1889426924 1889426924>
E..4~#@.@................8........8r$......
p.].p.].
19:29:52.072855 IP localhost.53643 > localhost.45484: . 360448:376832(16384) ack 1 win 257 <nop,nop,timestamp 1889426924 1889426923>
E.@4$s@.@..N.................8......>).....
p.].p.]...............................
19:29:52.072907 IP localhost.53643 > localhost.45484: . 376832:393216(16384) ack 1 win 257 <nop,nop,timestamp 1889426924 1889426923>
E.@4$t@.@..M.................8......>).....
p.].p.].A.A.A.A.A.A.A...A.A.A.A.A.A.A.
19:29:52.072920 IP localhost.45484 > localhost.53643: . ack 393216 win 14450 <nop,nop,timestamp 1889426924 1889426924>
E..4~$@.@................8........8r.......
p.].p.].
19:29:52.072977 IP localhost.53643 > localhost.45484: . 393216:409600(16384) ack 1 win 257 <nop,nop,timestamp 1889426924 1889426924>
E.@4$u@.@..L.................8......>).....
p.].p.]...............................
19:29:52.073028 IP localhost.53643 > localhost.45484: . 409600:425984(16384) ack 1 win 257 <nop,nop,timestamp 1889426924 1889426924>
E.@4$v@.@..K..............R..8......>).....
p.].p.]...............................
19:29:52.073041 IP localhost.45484 > localhost.53643: . ack 425984 win 14450 <nop,nop,timestamp 1889426924 1889426924>
E..4~%@.@................8........8r$......
p.].p.].
19:29:52.073088 IP localhost.53643 > localhost.45484: . 425984:442368(16384) ack 1 win 257 <nop,nop,timestamp 1889426924 1889426924>
E.@4$w@.@..J.................8......>).....
p.].p.].<.;.;.<.;.;.;.;.;...;.;.;.<.;.
19:29:52.073138 IP localhost.53643 > localhost.45484: . 442368:458752(16384) ack 1 win 257 <nop,nop,timestamp 1889426924 1889426924>
E.@4$x@.@..I.................8......>).....
p.].p.]...............................
19:29:52.073154 IP localhost.45484 > localhost.53643: . ack 458752 win 14450 <nop,nop,timestamp 1889426924 1889426924>
E..4~&@.@................8........8r.......
p.].p.].
19:29:52.073199 IP localhost.53643 > localhost.45484: . 458752:475136(16384) ack 1 win 257 <nop,nop,timestamp 1889426925 1889426924>
E.@4$y@.@..H.................8......>).....
p.].p.].i.i.i...i.i.i.i.i.i.i.i.i.i.i.
19:29:52.073253 IP localhost.53643 > localhost.45484: . 475136:491520(16384) ack 1 win 257 <nop,nop,timestamp 1889426925 1889426924>
E.@4$z@.@..G..............R..8......>).....
p.].p.]...............................
19:29:52.073269 IP localhost.45484 > localhost.53643: . ack 491520 win 14450 <nop,nop,timestamp 1889426925 1889426925>
E..4~'@.@................8........8r$......
p.].p.].
19:29:52.073317 IP localhost.53643 > localhost.45484: . 491520:507904(16384) ack 1 win 257 <nop,nop,timestamp 1889426925 1889426924>
E.@4${@.@..F.................8......>).....
p.].p.].s.s.s.s.r.r.s.s.s.s.s.s.s.s.s.
19:29:52.073366 IP localhost.53643 > localhost.45484: . 507904:524288(16384) ack 1 win 257 <nop,nop,timestamp 1889426925 1889426924>
E.@4$|@.@..E.................8......>).....
p.].p.].:.:.:.:.:...:.;.:.:.;.:.:.:.:.
19:29:52.073382 IP localhost.45484 > localhost.53643: . ack 524288 win 14450 <nop,nop,timestamp 1889426925 1889426925>
E..4~(@.@................8........8r.......
p.].p.].
19:29:52.073438 IP localhost.53643 > localhost.45484: . 524288:540672(16384) ack 1 win 257 <nop,nop,timestamp 1889426925 1889426924>
E.@4$}@.@..D.................8......>).....
p.].p.]...............................
19:29:52.073490 IP localhost.53643 > localhost.45484: . 540672:557056(16384) ack 1 win 257 <nop,nop,timestamp 1889426925 1889426924>
E.@4$~@.@..C..............R..8......>).....
p.].p.].R.R.R.R.R.R.R.R.R.R.R.R.R.Q.Q.
19:29:52.073504 IP localhost.45484 > localhost.53643: . ack 557056 win 14450 <nop,nop,timestamp 1889426925 1889426925>
E..4~)@.@................8........8r$......
p.].p.].
19:29:52.073550 IP localhost.53643 > localhost.45484: . 557056:573440(16384) ack 1 win 257 <nop,nop,timestamp 1889426925 1889426924>
E.@4$.@.@..B.................8......>).....
p.].p.].P.P.P.K.L.K.L...L.L.L.L.L.L.L.
19:29:52.073603 IP localhost.53643 > localhost.45484: . 573440:589824(16384) ack 1 win 257 <nop,nop,timestamp 1889426925 1889426924>
E.@4$.@.@..A.................8......>).....
p.].p.]...............................
19:29:52.073619 IP localhost.45484 > localhost.53643: . ack 589824 win 14450 <nop,nop,timestamp 1889426925 1889426925>
E..4~*@.@................8........8r.......
p.].p.].
19:29:52.073662 IP localhost.53643 > localhost.45484: . 589824:606208(16384) ack 1 win 257 <nop,nop,timestamp 1889426925 1889426924>
E.@4$.@.@..@.................8......>).....
p.].p.].F.F.F.F.F.F.F.F.F.F.F.F.F.F.F.
19:29:52.073719 IP localhost.53643 > localhost.45484: . 606208:622592(16384) ack 1 win 257 <nop,nop,timestamp 1889426925 1889426924>
E.@4$.@.@..?..............R..8......>).....
p.].p.]...............................
19:29:52.073733 IP localhost.45484 > localhost.53643: . ack 622592 win 14450 <nop,nop,timestamp 1889426925 1889426925>
E..4~+@.@................8........8r$......
p.].p.].
19:29:52.073776 IP localhost.53643 > localhost.45484: . 622592:638976(16384) ack 1 win 257 <nop,nop,timestamp 1889426925 1889426924>
E.@4$.@.@..>.................8......>).....
p.].p.]...............................
19:29:52.073828 IP localhost.53643 > localhost.45484: . 638976:655360(16384) ack 1 win 257 <nop,nop,timestamp 1889426925 1889426924>
E.@4$.@.@..=.................8......>).....
p.].p.]...............................
19:29:52.073845 IP localhost.45484 > localhost.53643: . ack 655360 win 14450 <nop,nop,timestamp 1889426925 1889426925>
E..4~,@.@................8........8r.......
p.].p.].
19:29:52.073892 IP localhost.53643 > localhost.45484: . 655360:671744(16384) ack 1 win 257 <nop,nop,timestamp 1889426925 1889426924>
E.@4$.@.@..<.................8......>).....
p.].p.].3.3.3.3.3.3.3...3.3.3.3.3.3.3.
19:29:52.073944 IP localhost.53643 > localhost.45484: . 671744:688128(16384) ack 1 win 257 <nop,nop,timestamp 1889426925 1889426924>
E.@4$.@.@..;..............R..8......>).....
p.].p.].e.d.e.e.e.e.d.d.d.e.e.e.e.e.e.
19:29:52.073966 IP localhost.45484 > localhost.53643: . ack 688128 win 14450 <nop,nop,timestamp 1889426925 1889426925>
E..4~-@.@................8........8r$......
p.].p.].
19:29:52.074008 IP localhost.53643 > localhost.45484: . 688128:704512(16384) ack 1 win 257 <nop,nop,timestamp 1889426925 1889426924>
E.@4$.@.@..:.................8......>).....
p.].p.].S...S.S.S.S.S.S.S.S.S.S.S.R.S.
19:29:52.074056 IP localhost.53643 > localhost.45484: . 704512:720896(16384) ack 1 win 257 <nop,nop,timestamp 1889426925 1889426924>
E.@4$.@.@..9.................8......>).....
p.].p.].2.2.2.2.2.2.2.2.2...2.2.2.3.2.
19:29:52.074065 IP localhost.45484 > localhost.53643: . ack 720896 win 14450 <nop,nop,timestamp 1889426925 1889426925>
E..4~.@.@................8........8r......
p.].p.].
19:29:52.074158 IP localhost.45484 > localhost.53643: . ack 753664 win 14450 <nop,nop,timestamp 1889426925 1889426925>
E..4~/@.@................8........8r$.....
p.].p.].
19:29:52.074212 IP localhost.53643 > localhost.45484: P 753664:770048(16384) ack 1 win 257 <nop,nop,timestamp 1889426926 1889426924>
E.@4$.@.@..6.................8......>).....
p.].p.].?.?.?.?.?.?.?.?.>.?.?...?.?.?.
19:29:52.074326 IP localhost.53643 > localhost.45484: . 770048:786432(16384) ack 1 win 257 <nop,nop,timestamp 1889426926 1889426925>
E.@4$.@.@..5.................8......>).....
p.].p.]...............................
19:29:52.074339 IP localhost.45484 > localhost.53643: . ack 786432 win 14450 <nop,nop,timestamp 1889426926 1889426926>
E..4~0@.@................8........8r.
.....
p.].p.].
19:29:52.074392 IP localhost.53643 > localhost.45484: . 786432:802816(16384) ack 1 win 257 <nop,nop,timestamp 1889426926 1889426925>
E.@4$.@.@..4.................8......>).....
p.].p.]...............................
19:29:52.074449 IP localhost.53643 > localhost.45484: . 802816:819200(16384) ack 1 win 257 <nop,nop,timestamp 1889426926 1889426925>
E.@4$.@.@..3..............R..8......>).....
p.].p.].....Z......._.......c.......h.
19:29:52.074458 IP localhost.45484 > localhost.53643: . ack 819200 win 14450 <nop,nop,timestamp 1889426926 1889426926>
E..4~1@.@................8........8r$
.....
p.].p.].
19:29:52.074578 IP localhost.45484 > localhost.53643: . ack 851968 win 14450 <nop,nop,timestamp 1889426926 1889426926>
E..4~2@.@................8........8r.	.....
p.].p.].
19:29:52.074649 IP localhost.45484 > localhost.53643: . ack 861256 win 14482 <nop,nop,timestamp 1889426926 1889426926>
E..4~3@.@................8....6S..8........
p.].p.].
19:29:52.097703 IP localhost.45482 > localhost.36361: P 1963111993:1963112202(209) ack 1966045646 win 265 <nop,nop,timestamp 1889426949 1889425949>
E...(o@.@..............	u..9u/y....	.......
p.^.p.Z..............................l
19:29:52.097729 IP localhost.36361 > localhost.45482: . ack 209 win 387 <nop,nop,timestamp 1889426949 1889426949>
E..4.E@.@.!}.........	..u/y.u..
.....1.....
p.^.p.^.
19:29:52.149974 IP localhost.5901 > localhost.43940: P 2811735920:2811735924(4) ack 2711280401 win 256 <nop,nop,timestamp 1889427001 1889426010>
E..8q.@.@.................p.........,.....
p.^9p.ZZ....
19:29:52.150080 IP localhost.5901 > localhost.43940: P 4:3488(3484) ack 1 win 256 <nop,nop,timestamp 1889427001 1889426010>
E..q.@.@.."..............t...............
p.^9p.ZZ.Q.S.>........................
19:29:52.150104 IP localhost.43940 > localhost.5901: . ack 3488 win 8101 <nop,nop,timestamp 1889427001 1889427001>
E..4.|@.@..E........................`.....
p.^9p.^9
19:29:52.150244 IP localhost.5901 > localhost.43940: P 3488:7980(4492) ack 1 win 256 <nop,nop,timestamp 1889427002 1889427001>
E...q.@.@..1..............................
p.^:p.^9...S.P........................
19:29:52.157138 IP localhost.43940 > localhost.5901: P 1:11(10) ack 7980 win 8101 <nop,nop,timestamp 1889427008 1889427002>
E..>.}@.@..:........................2.....
p.^@p.^:..........
19:29:52.157156 IP localhost.5901 > localhost.43940: . ack 11 win 256 <nop,nop,timestamp 1889427008 1889427008>
E..4q.@.@..........................$a.....
p.^@p.^@
19:29:53.065567 IP localhost.51423 > localhost.45487: . 35021:51405(16384) ack 1 win 257 <nop,nop,timestamp 1889427917 1889426917>
E.@4..@.@.r:............Z...N..M....>).....
p.a.p.]..........................3e...
19:29:53.065594 IP localhost.45487 > localhost.51423: . ack 51405 win 2605 <nop,nop,timestamp 1889427917 1889427917>
E..4D.@.@..>............N..MZ.Q...
-8......
p.a.p.a.
19:29:53.065604 IP localhost.51423 > localhost.45487: . 51405:67789(16384) ack 1 win 257 <nop,nop,timestamp 1889427917 1889426917>
E.@4..@.@.r9............Z.Q.N..M....>).....
p.a.p.]...............................
19:29:53.065623 IP localhost.45487 > localhost.51423: . ack 67789 win 2507 <nop,nop,timestamp 1889427917 1889427917>
E..4D.@.@..=............N..MZ.....	........
p.a.p.a.
19:29:53.065625 IP localhost.51423 > localhost.45487: P 67789:70042(2253) ack 1 win 257 <nop,nop,timestamp 1889427917 1889427917>
E.	...@.@..k............Z...N..M...........
p.a.p.a...............................
19:29:53.065637 IP localhost.45487 > localhost.51423: . ack 70042 win 2490 <nop,nop,timestamp 1889427917 1889427917>
E..4D.@.@..<............N..MZ.....	..I.....
p.a.p.a.
19:29:53.070501 IP localhost.53643 > localhost.45484: . 861256:877640(16384) ack 1 win 257 <nop,nop,timestamp 1889427922 1889426926>
E.@4$.@.@../..............6S.8......>).....
p.a.p.]..$H..........................
19:29:53.070525 IP localhost.45484 > localhost.53643: . ack 877640 win 14450 <nop,nop,timestamp 1889427922 1889427922>
E..4~4@.@................8....vS..8r7......
p.a.p.a.
19:29:53.070549 IP localhost.53643 > localhost.45484: . 877640:894024(16384) ack 1 win 257 <nop,nop,timestamp 1889427922 1889426926>
E.@4$.@.@.................vS.8......>).....
p.a.p.]...............................
19:29:53.070559 IP localhost.45484 > localhost.53643: . ack 894024 win 14351 <nop,nop,timestamp 1889427922 1889427922>
E..4~5@.@................8.....S..8..[.....
p.a.p.a.
19:29:53.071277 IP localhost.53643 > localhost.45484: . 894024:910408(16384) ack 1 win 257 <nop,nop,timestamp 1889427923 1889427922>
E.@4$.@.@..-...............S.8......>).....
p.a.p.a...............................
19:29:53.071291 IP localhost.45484 > localhost.53643: . ack 910408 win 14252 <nop,nop,timestamp 1889427923 1889427923>
E..4~6@.@................8.....S..7........
p.a.p.a.
19:29:53.071308 IP localhost.45484 > localhost.53643: . ack 926792 win 14154 <nop,nop,timestamp 1889427923 1889427923>
E..4~7@.@................8....6S..7Jy......
p.a.p.a.
19:29:53.071326 IP localhost.45484 > localhost.53643: . ack 943176 win 14055 <nop,nop,timestamp 1889427923 1889427923>
E..4~8@.@................8....vS..6.9......
p.a.p.a.
19:29:53.071342 IP localhost.45484 > localhost.53643: . ack 959560 win 13956 <nop,nop,timestamp 1889427923 1889427923>
E..4~9@.@................8.....S..6........
p.a.p.a.
19:29:53.071360 IP localhost.45484 > localhost.53643: . ack 975944 win 13858 <nop,nop,timestamp 1889427923 1889427923>
E..4~:@.@................8.....S..6".E.....
p.a.p.a.
19:29:53.071376 IP localhost.45484 > localhost.53643: . ack 992328 win 13759 <nop,nop,timestamp 1889427923 1889427923>
E..4~;@.@................8....6S..5.z......
p.a.p.a.
19:29:53.071393 IP localhost.45484 > localhost.53643: . ack 1008712 win 13661 <nop,nop,timestamp 1889427923 1889427923>
E..4~<@.@................8....vS..5];
.....
p.a.p.a.
19:29:53.072034 IP localhost.45484 > localhost.53643: . ack 1418312 win 11194 <nop,nop,timestamp 1889427923 1889427923>
E..4~D@.@..}.............8.....S..+........
p.a.p.a.
19:29:53.072716 IP localhost.45484 > localhost.53643: . ack 1722512 win 14482 <nop,nop,timestamp 1889427924 1889427923>
E..4~E@.@..|.............8....Z...8.S......
p.a.p.a.
19:29:53.096425 IP localhost.45482 > localhost.36361: P 209:418(209) ack 1 win 265 <nop,nop,timestamp 1889427948 1889426949>
E...(p@.@..............	u..
u/y....	.......
p.a.p.^...............................
19:29:53.096474 IP localhost.36361 > localhost.45482: . ack 418 win 387 <nop,nop,timestamp 1889427948 1889427948>
E..4.F@.@.!|.........	..u/y.u.......v......
p.a.p.a.
19:29:53.148974 IP localhost.5901 > localhost.43940: P 7980:7984(4) ack 11 win 256 <nop,nop,timestamp 1889428000 1889427008>
E..8q.@.@...........................,.....
p.b p.^@....
19:29:53.149066 IP localhost.5901 > localhost.43940: P 7984:11468(3484) ack 11 win 256 <nop,nop,timestamp 1889428000 1889427008>
E..q.@.@.................................
p.b p.^@.Q.S.>........................
19:29:53.149096 IP localhost.43940 > localhost.5901: . ack 11468 win 8101 <nop,nop,timestamp 1889428000 1889428000>
E..4.~@.@..C..................<.....[.....
p.b p.b 
19:29:53.149112 IP localhost.5901 > localhost.43940: P 11468:15960(4492) ack 11 win 256 <nop,nop,timestamp 1889428000 1889428000>
E...q.@.@..-..............<...............
p.b p.b ...S.P........................
19:29:53.156385 IP localhost.43940 > localhost.5901: P 11:21(10) ack 15960 win 8101 <nop,nop,timestamp 1889428008 1889428000>
E..>..@.@..8........................2.....
p.b(p.b ..........
19:29:53.156403 IP localhost.5901 > localhost.43940: . ack 21 win 256 <nop,nop,timestamp 1889428008 1889428008>
E..4q	@.@.....................%.....Z.....
p.b(p.b(
19:29:54.065636 IP localhost.51423 > localhost.45487: . 70042:86426(16384) ack 1 win 257 <nop,nop,timestamp 1889428917 1889427917>
E.@4..@.@.r7............Z...N..M....>).....
p.e.p.a..........................a'...
19:29:54.065661 IP localhost.45487 > localhost.51423: . ack 86426 win 2605 <nop,nop,timestamp 1889428917 1889428917>
E..4D.@.@..;............N..MZ.....
-.......
p.e.p.e.
19:29:54.065665 IP localhost.51423 > localhost.45487: . 86426:102810(16384) ack 1 win 257 <nop,nop,timestamp 1889428917 1889427917>
E.@4..@.@.r6............Z...N..M....>).....
p.e.p.a...............................
19:29:54.065682 IP localhost.45487 > localhost.51423: . ack 102810 win 2507 <nop,nop,timestamp 1889428917 1889428917>
E..4D.@.@..:............N..MZ.....	.hh.....
p.e.p.e.
19:29:54.065680 IP localhost.51423 > localhost.45487: P 102810:105063(2253) ack 1 win 257 <nop,nop,timestamp 1889428917 1889428917>
E.	...@.@..h............Z...N..M...........
p.e.p.e...............................
19:29:54.065692 IP localhost.45487 > localhost.51423: . ack 105063 win 2490 <nop,nop,timestamp 1889428917 1889428917>
E..4D.@.@..9............N..MZ.#_..	._......
p.e.p.e.
19:29:54.070745 IP localhost.53643 > localhost.45484: . 1722512:1738896(16384) ack 1 win 257 <nop,nop,timestamp 1889428922 1889427924>
E.@4$.@.@.................Z..8......>).....
p.e.p.a..$H..........................
19:29:54.070772 IP localhost.45484 > localhost.53643: . ack 1738896 win 14450 <nop,nop,timestamp 1889428922 1889428922>
E..4~F@.@..{.............8........8r.......
p.e.p.e.
19:29:54.070827 IP localhost.53643 > localhost.45484: . 1738896:1755280(16384) ack 1 win 257 <nop,nop,timestamp 1889428922 1889427924>
E.@4$.@.@....................8......>).....
p.e.p.a...............................
19:29:54.070838 IP localhost.45484 > localhost.53643: . ack 1755280 win 14351 <nop,nop,timestamp 1889428922 1889428922>
E..4~G@.@..z.............8........8..6.....
p.e.p.e.
19:29:54.071673 IP localhost.53643 > localhost.45484: . 1755280:1771664(16384) ack 1 win 257 <nop,nop,timestamp 1889428923 1889428922>
E.@4$.@.@....................8......>).....
p.e.p.e...............................
19:29:54.071699 IP localhost.45484 > localhost.53643: . ack 1771664 win 14450 <nop,nop,timestamp 1889428923 1889428923>
E..4~H@.@..y.............8........8r.......
p.e.p.e.
19:29:54.071714 IP localhost.53643 > localhost.45484: . 1771664:1788048(16384) ack 1 win 257 <nop,nop,timestamp 1889428923 1889428922>
E.@4$.@.@....................8......>).....
p.e.p.e...............................
19:29:54.071724 IP localhost.45484 > localhost.53643: . ack 1788048 win 14351 <nop,nop,timestamp 1889428923 1889428923>
E..4~I@.@..x.............8....Z...8.L4.....
p.e.p.e.
19:29:54.071738 IP localhost.53643 > localhost.45484: . 1788048:1804432(16384) ack 1 win 257 <nop,nop,timestamp 1889428923 1889428922>
E.@4$.@.@.................Z..8......>).....
p.e.p.e...............................
19:29:54.071750 IP localhost.45484 > localhost.53643: . ack 1804432 win 14252 <nop,nop,timestamp 1889428923 1889428923>
E..4~J@.@..w.............8........7........
p.e.p.e.
19:29:54.071759 IP localhost.53643 > localhost.45484: . 1804432:1820816(16384) ack 1 win 257 <nop,nop,timestamp 1889428923 1889428922>
E.@4$.@.@....................8......>).....
p.e.p.e...............................
19:29:54.071771 IP localhost.45484 > localhost.53643: . ack 1820816 win 14154 <nop,nop,timestamp 1889428923 1889428923>
E..4~K@.@..v.............8........7J.......
p.e.p.e.
19:29:54.071781 IP localhost.53643 > localhost.45484: . 1820816:1837200(16384) ack 1 win 257 <nop,nop,timestamp 1889428923 1889428923>
E.@4$.@.@....................8......>).....
p.e.p.e...............................
19:29:54.071803 IP localhost.53643 > localhost.45484: . 1837200:1853584(16384) ack 1 win 257 <nop,nop,timestamp 1889428923 1889428923>
E.@4$.@.@....................8......>).....
p.e.p.e...............................
19:29:54.071816 IP localhost.53643 > localhost.45484: . 1853584:1869968(16384) ack 1 win 257 <nop,nop,timestamp 1889428923 1889428923>
E.@4$.@.@.................Z..8......>).....
p.e.p.e.H/j.1..-...'+@........)\....0@
19:29:54.071826 IP localhost.53643 > localhost.45484: . 1869968:1886352(16384) ack 1 win 257 <nop,nop,timestamp 1889428923 1889428923>
E.@4$.@.@....................8......>).....
p.e.p.e........-...'..^d.~...@.-...'..
19:29:54.071848 IP localhost.53643 > localhost.45484: . 1902736:1919120(16384) ack 1 win 257 <nop,nop,timestamp 1889428923 1889428923>
E.@4$.@.@....................8......>).....
p.e.p.e.3.3.4.4.3.3.3...3.3.3.3.4.3.3.
19:29:54.071861 IP localhost.53643 > localhost.45484: . 1919120:1935504(16384) ack 1 win 257 <nop,nop,timestamp 1889428923 1889428923>
E.@4$.@.@.................Z..8......>).....
p.e.p.e.?.?.?.?.?.?.?.?.?.?.?.?.?.?.?.
19:29:54.071871 IP localhost.53643 > localhost.45484: . 1935504:1951888(16384) ack 1 win 257 <nop,nop,timestamp 1889428923 1889428923>
E.@4$.@.@....................8......>).....
p.e.p.e...............................
19:29:54.071883 IP localhost.45484 > localhost.53643: . ack 1837200 win 14450 <nop,nop,timestamp 1889428923 1889428923>
E..4~L@.@..u.............8........8r.......
p.e.p.e.
19:29:54.071914 IP localhost.45484 > localhost.53643: . ack 1853584 win 14351 <nop,nop,timestamp 1889428923 1889428923>
E..4~M@.@..t.............8....Z...8.L3.....
p.e.p.e.
19:29:54.071927 IP localhost.45484 > localhost.53643: . ack 1869968 win 14252 <nop,nop,timestamp 1889428923 1889428923>
E..4~N@.@..s.............8........7........
p.e.p.e.
19:29:54.071939 IP localhost.45484 > localhost.53643: . ack 1886352 win 14154 <nop,nop,timestamp 1889428923 1889428923>
E..4~O@.@..r.............8........7J.......
p.e.p.e.
19:29:54.071953 IP localhost.45484 > localhost.53643: . ack 1902736 win 14055 <nop,nop,timestamp 1889428923 1889428923>
E..4~P@.@..q.............8........6..Z.....
p.e.p.e.
19:29:54.071967 IP localhost.45484 > localhost.53643: . ack 1919120 win 13956 <nop,nop,timestamp 1889428923 1889428923>
E..4~Q@.@..p.............8....Z...6.M......
p.e.p.e.
19:29:54.071981 IP localhost.45484 > localhost.53643: . ack 1935504 win 13858 <nop,nop,timestamp 1889428923 1889428923>
E..4~R@.@..o.............8........6".......
p.e.p.e.
19:29:54.071996 IP localhost.45484 > localhost.53643: . ack 1951888 win 13759 <nop,nop,timestamp 1889428923 1889428923>
E..4~S@.@..n.............8........5........
p.e.p.e.
19:29:54.072062 IP localhost.53643 > localhost.45484: . 1951888:1968272(16384) ack 1 win 257 <nop,nop,timestamp 1889428923 1889428923>
E.@4$.@.@....................8......>).....
p.e.p.e.@.@.@.@.@.@.@.@.@...@.@.@.@.@.
19:29:54.072080 IP localhost.53643 > localhost.45484: . 1968272:1984656(16384) ack 1 win 257 <nop,nop,timestamp 1889428923 1889428923>
E.@4$.@.@....................8......>).....
p.e.p.e.O.O.O.O.O.O.O.O.O.O.O.O.O.O.O.
19:29:54.072097 IP localhost.53643 > localhost.45484: . 1984656:2001040(16384) ack 1 win 257 <nop,nop,timestamp 1889428923 1889428923>
E.@4$.@.@.................Z..8......>).....
p.e.p.e...............................
19:29:54.072107 IP localhost.53643 > localhost.45484: . 2001040:2017424(16384) ack 1 win 257 <nop,nop,timestamp 1889428923 1889428923>
E.@4$.@.@....................8......>).....
p.e.p.e.H.I.I.H.H.H.I.H.H.H.H...I.H.H.
19:29:54.072122 IP localhost.53643 > localhost.45484: . 2017424:2033808(16384) ack 1 win 257 <nop,nop,timestamp 1889428923 1889428923>
E.@4$.@.@....................8......>).....
p.e.p.e...............................
19:29:54.072146 IP localhost.53643 > localhost.45484: . 2033808:2050192(16384) ack 1 win 257 <nop,nop,timestamp 1889428923 1889428923>
E.@4$.@.@....................8......>).....
p.e.p.e.B.B.B.B.B.B.B...B.B.B.B.B.B.B.
19:29:54.072160 IP localhost.53643 > localhost.45484: . 2050192:2066576(16384) ack 1 win 257 <nop,nop,timestamp 1889428923 1889428923>
E.@4$.@.@.................Z..8......>).....
p.e.p.e...............................
19:29:54.072172 IP localhost.53643 > localhost.45484: . 2066576:2082960(16384) ack 1 win 257 <nop,nop,timestamp 1889428923 1889428923>
E.@4$.@.@....................8......>).....
p.e.p.e.S...R.S.S.R.S.S.S.S.S.R.R.R.R.
19:29:54.072187 IP localhost.53643 > localhost.45484: . 2082960:2099344(16384) ack 1 win 257 <nop,nop,timestamp 1889428923 1889428923>
E.@4$.@.@....................8......>).....
p.e.p.e...............................
19:29:54.072198 IP localhost.53643 > localhost.45484: . 2099344:2115728(16384) ack 1 win 257 <nop,nop,timestamp 1889428923 1889428923>
E.@4$.@.@....................8......>).....
p.e.p.e.A.A.A.A.A.A.A.A.A.A.A.A.A.A.A.
19:29:54.072213 IP localhost.53643 > localhost.45484: . 2115728:2132112(16384) ack 1 win 257 <nop,nop,timestamp 1889428924 1889428923>
E.@4$.@.@.................Z..8......>).....
p.e.p.e...............................
19:29:54.072224 IP localhost.53643 > localhost.45484: . 2132112:2148496(16384) ack 1 win 257 <nop,nop,timestamp 1889428924 1889428923>
E.@4$.@.@....................8......>).....
p.e.p.e...............................
19:29:54.072238 IP localhost.53643 > localhost.45484: . 2148496:2164880(16384) ack 1 win 257 <nop,nop,timestamp 1889428924 1889428923>
E.@4$.@.@....................8......>).....
p.e.p.e.;.;.;.;.<.<.;.<.;.;.;.;.;.;.;.
19:29:54.072124 IP localhost.45484 > localhost.53643: . ack 1968272 win 14450 <nop,nop,timestamp 1889428923 1889428923>
E..4~T@.@..m.............8........8r.......
p.e.p.e.
19:29:54.072326 IP localhost.53643 > localhost.45484: . 2214032:2230416(16384) ack 1 win 257 <nop,nop,timestamp 1889428924 1889428923>
E.@4$.@.@....................8......>).....
p.e.p.e.s.s.s.s.s.r.r...s.s.r.s.s.s.r.
19:29:54.072330 IP localhost.53643 > localhost.45484: . 2230416:2246800(16384) ack 1 win 257 <nop,nop,timestamp 1889428924 1889428923>
E.@4$.@.@....................8......>).....
p.e.p.e.:.:.:.:.;.:.:.;.:.:.:.:.:.:.:.
19:29:54.072378 IP localhost.45484 > localhost.53643: . ack 1984656 win 14351 <nop,nop,timestamp 1889428924 1889428923>
E..4~U@.@..l.............8....Z...8.L0.....
p.e.p.e.
19:29:54.072399 IP localhost.53643 > localhost.45484: . 2246800:2263184(16384) ack 1 win 257 <nop,nop,timestamp 1889428924 1889428924>
E.@4$.@.@.................Z..8......>).....
p.e.p.e...............................
19:29:54.072402 IP localhost.53643 > localhost.45484: . 2263184:2279568(16384) ack 1 win 257 <nop,nop,timestamp 1889428924 1889428924>
E.@4$.@.@....................8......>).....
p.e.p.e.R.R.R.R.R.R.R.R.Q.Q.R...R.R.Q.
19:29:54.072684 IP localhost.45484 > localhost.53643: . ack 2279568 win 14482 <nop,nop,timestamp 1889428924 1889428923>
E..4~V@.@..k.............8........8........
p.e.p.e.
19:29:54.073098 IP localhost.45484 > localhost.53643: . ack 2583768 win 14482 <nop,nop,timestamp 1889428924 1889428924>
E..4~W@.@..j.............8....~...8.'[.....
p.e.p.e.
19:29:54.097378 IP localhost.45482 > localhost.36361: P 418:627(209) ack 1 win 265 <nop,nop,timestamp 1889428949 1889427948>
E...(q@.@..............	u...u/y....	.......
p.e.p.a...............................
19:29:54.097410 IP localhost.36361 > localhost.45482: . ack 627 win 387 <nop,nop,timestamp 1889428949 1889428949>
E..4.G@.@.!{.........	..u/y.u.......m......
p.e.p.e.
19:29:54.149351 IP localhost.5901 > localhost.43940: P 15960:15964(4) ack 21 win 256 <nop,nop,timestamp 1889429001 1889428008>
E..8q
@.@.....................%.....,.....
p.f	p.b(....
19:29:54.149445 IP localhost.5901 > localhost.43940: P 15964:19448(3484) ack 21 win 256 <nop,nop,timestamp 1889429001 1889428008>
E..q.@.@.....................%...........
p.f	p.b(.Q.S.>........................
19:29:54.149488 IP localhost.43940 > localhost.5901: . ack 19448 win 8101 <nop,nop,timestamp 1889429001 1889429001>
E..4..@.@..A..............%...h.....S.....
p.f	p.f	
19:29:54.149503 IP localhost.5901 > localhost.43940: P 19448:23940(4492) ack 21 win 256 <nop,nop,timestamp 1889429001 1889429001>
E...q.@.@..)..............h...%...........
p.f	p.f	...S.P........................
19:29:54.156662 IP localhost.43940 > localhost.5901: P 21:31(10) ack 23940 win 8101 <nop,nop,timestamp 1889429008 1889429001>
E..>..@.@..6..............%.........2.....
p.f.p.f	..........
19:29:54.156682 IP localhost.5901 > localhost.43940: . ack 31 win 256 <nop,nop,timestamp 1889429008 1889429008>
E..4q@.@...................../.....T.....
p.f.p.f.
19:29:55.065581 IP localhost.51423 > localhost.45487: . 105063:121447(16384) ack 1 win 257 <nop,nop,timestamp 1889429917 1889428917>
E.@4..@.@.r4............Z.#_N..M....>).....
p.i.p.e...............................
19:29:55.065608 IP localhost.45487 > localhost.51423: . ack 121447 win 2605 <nop,nop,timestamp 1889429917 1889429917>
E..4D.@.@..8............N..MZ.c_..
-.i.....
p.i.p.i.
19:29:55.065612 IP localhost.51423 > localhost.45487: . 121447:137831(16384) ack 1 win 257 <nop,nop,timestamp 1889429917 1889428917>
E.@4..@.@.r3............Z.c_N..M....>).....
p.i.p.e...............................
19:29:55.065631 IP localhost.45487 > localhost.51423: . ack 137831 win 2507 <nop,nop,timestamp 1889429917 1889429917>
E..4D.@.@..7............N..MZ.._..	........
p.i.p.i.
19:29:55.065632 IP localhost.51423 > localhost.45487: P 137831:140084(2253) ack 1 win 257 <nop,nop,timestamp 1889429917 1889429917>
E.	...@.@..e............Z.._N..M...........
p.i.p.i...............................
19:29:55.065645 IP localhost.45487 > localhost.51423: . ack 140084 win 2490 <nop,nop,timestamp 1889429917 1889429917>
E..4D.@.@..6............N..MZ..,..	........
p.i.p.i.
19:29:55.069407 IP localhost.53643 > localhost.45484: . 2583768:2600152(16384) ack 1 win 257 <nop,nop,timestamp 1889429921 1889428924>
E.@4$.@.@.................~..8......>).....
p.i.p.e..$H......................q...
19:29:55.069432 IP localhost.45484 > localhost.53643: . ack 2600152 win 14450 <nop,nop,timestamp 1889429921 1889429921>
E..4~X@.@..i.............8........8r.......
p.i.p.i.
19:29:55.069524 IP localhost.53643 > localhost.45484: . 2600152:2616536(16384) ack 1 win 257 <nop,nop,timestamp 1889429921 1889428924>
E.@4$.@.@....................8......>).....
p.i.p.e...............................
19:29:55.069536 IP localhost.45484 > localhost.53643: . ack 2616536 win 14450 <nop,nop,timestamp 1889429921 1889429921>
E..4~Y@.@..h.............8........8r.......
p.i.p.i.
19:29:55.070273 IP localhost.53643 > localhost.45484: . 2616536:2632920(16384) ack 1 win 257 <nop,nop,timestamp 1889429922 1889429921>
E.@4$.@.@....................8......>).....
p.i.p.i...............................
19:29:55.070292 IP localhost.45484 > localhost.53643: . ack 2632920 win 14450 <nop,nop,timestamp 1889429922 1889429922>
E..4~Z@.@..g.............8....>...8r_......
p.i.p.i.
19:29:55.070346 IP localhost.53643 > localhost.45484: . 2632920:2649304(16384) ack 1 win 257 <nop,nop,timestamp 1889429922 1889429921>
E.@4$.@.@.................>..8......>).....
p.i.p.i...............................
19:29:55.070358 IP localhost.45484 > localhost.53643: . ack 2649304 win 14450 <nop,nop,timestamp 1889429922 1889429922>
E..4~[@.@..f.............8....~...8r.......
p.i.p.i.
19:29:55.070406 IP localhost.53643 > localhost.45484: . 2649304:2665688(16384) ack 1 win 257 <nop,nop,timestamp 1889429922 1889429921>
E.@4%.@.@.................~..8......>).....
p.i.p.i...............................
19:29:55.070417 IP localhost.45484 > localhost.53643: . ack 2665688 win 14450 <nop,nop,timestamp 1889429922 1889429922>
E..4~\@.@..e.............8........8r.......
p.i.p.i.
19:29:55.070459 IP localhost.53643 > localhost.45484: . 2665688:2682072(16384) ack 1 win 257 <nop,nop,timestamp 1889429922 1889429921>
E.@4%.@.@....................8......>).....
p.i.p.i...............................
